, - Полтавська Чутівський Жовтневе вул. -, буд. -, кв.,
, - Полтавська Чутівський Жовтневе вул. -, буд. -, кв.,
, 0000 Чернігівська Чернігівський Чернігів 0000, Чернігівська область,
Дніпропетровська Верхньодніпровський с.Водяне 00000, Дніпропетровська обл.,
Дніпропетровська Верхньодніпровський с.Водяне 00000, Дніпропетровська обл.,
Дніпропетровська П”Ятихатський Чумаки,
Дніпропетровська П”Ятихатський Чумаки,
Закарпатська Воловецький Завадка 00000, Закарпатська обл.,,
Закарпатська Воловецький Завадка 00000, Закарпатська обл.,,
Кіровоградська Долинський Кірово 00000, Кіровоградська обл.,
Одеська Павлівка 00000, Одеська обл.,
Одеська Павлівка 00000, Одеська обл.,
Сумська Буринський Ч.Слобода Ч.Слобода,
ХЕРСОНСЬКА ОБЛАСТЬ Білозерський район Східне вул. Б/Н, буд. Б/Н,
ХЕРСОНСЬКА ОБЛАСТЬ Білозерський район Східне вул. Б/Н, буд. Б/Н,
Хмельницька Красилівський Терешки,
ХМЕЛЬНИЦЬКА ОБЛАСТЬ Шепетівський район Мокіївці,
ХМЕЛЬНИЦЬКА ОБЛАСТЬ Шепетівський район Мокіївці,
ХМЕЛЬНИЦЬКА ОБЛАСТЬ Шепетівський район Червоний Цвіт,
ХМЕЛЬНИЦЬКА ОБЛАСТЬ Шепетівський район Червоний Цвіт,
Хмельницька Полонський с. Білецьке вул. немає, буд. 0,
Чернівецька Глибоцький Коровія вул. *, буд. *, кв.,
Чернівецька Глибоцький Коровія вул. *, буд. *, кв.,
, Арцизький с. Главані с. Главані,
, Донецька обл. Добропільський р-н Новоторецьке Б/Н,-,
, Донецька обл. Добропільський р-н Новоторецьке Б/Н,-,
, ДОНЕЦЬКА ОБЛАСТЬ Артемівський район Красний Пахар вул. 0, буд. 0,
, Житомирська Коростенський Граби *, Буд. *,
, Житомирська Коростенський Граби *, Буд. *,
, Житомирська Радомишльський Радомишль,
, ивано-франковская косивский старые куты глибковская,
, Івано-Франківська обл. Долинський р-н Гошів вул. ., буд. .,
, Івано-Франківська обл. Долинський р-н Гошів вул. ., буд. .,
, Івано-Франківська обл. Микуличин вул. без вулиці, буд. б/н,
, Івано-Франківська обл. Микуличин вул. без вулиці, буд. б/н,
, Івано-Франківська, с, Грамотне, вулиця, -, -
, Івано-Франківська, с, Грамотне, вулиця, -, -
, Івано-Франківська, с, Криворівня, вулиця, -, -
, Івано-Франківська, с, Криворівня, вулиця, -, -
, Кіровоградська Кіровоградський Устинівка,
, Львівська обл. Мостиський р-н Малнів,
, Львівська обл. Мостиський р-н Малнів,
, ЛЬВІВСЬКА ОБЛАСТЬ Самбірський район Ралівка вул. , д/в,
, ЛЬВІВСЬКА ОБЛАСТЬ Самбірський район Ралівка вул. , д/в,
, Миколаївська Миколаївський Федорівка,
, Миколаївська Новобузький Софіївка,
, МИКОЛАЇВСЬКА ОБЛАСТЬ Новоодеський район Димівське вул. _, буд. _,
, Миколаївська, с, Григорівка, вулиця, Григорівка, 0
, Одеська обл. Балтський р-н Андріяшівка вул-, буд-,
, Одеська обл. Котовський р-н Затишшя вул-, буд-,
, Одеська обл. Красноокнянський р-н Новосеменівка ., ., ., .,
, Одеська обл. Красноокнянський р-н Новосеменівка ., ., ., .,
, Полтавська обл. Глобинський р-н Великі Кринки б/н, . б/н, .,
, Полтавська обл. Глобинський р-н Тимошівка вул. б/н, буд. б/н,
, ПОЛТАВСЬКА ОБЛАСТЬ Глобинський район Пустовійтове вул-, буд-,
, ПОЛТАВСЬКА ОБЛАСТЬ Глобинський район Пустовійтове вул-, буд-,
, Рашівка Рашівка,
, Рівненська обл. Демидівський р-н малево вул. *, буд. *,
, Рівненська обл. Демидівський р-н малево вул. *, буд. *,
, Рівненська обл. Острозький р-н Плоска вул. Відсутня, буд. 0,
, Рівненська Ясинець,
, Словечно,
, Сумська Тростянецький с.Новгородське вул.,
, Тернопільська, с, Медин, вулиця, -, -
, Тернопільська, с, Медин, вулиця, -, -
, Харківська обл. Красноградський р-н Кирилівка вул. БЕЗ НАЗВИ, буд. Б/Н,
, Харківська обл. Красноградський р-н Кирилівка вул. БЕЗ НАЗВИ, буд. Б/Н,
, Харківська, с, Соснівка, вулиця
, Хмельницька Дунаєвецький Підлісний Мукарів Свердлова,
, Хмельницька Красилівський Терешки,
, Хмельницька обл. Городоцький р-н Кам”янка вул. *, *,
, Хмельницька обл. Городоцький р-н Кам”янка вул. *, *,
, Хмельницька обл. Дунаєвецький р-н Велика Побійна вул. *, буд. *,
, Хмельницька обл. Дунаєвецький р-н Велика Побійна вул. *, буд. *,
, Хмельницька обл. Дунаєвецький р-н Маліївці вул. *, буд. *,
, Хмельницька обл. Дунаєвецький р-н Маліївці вул. *, буд. *,
, ХМЕЛЬНИЦЬКА ОБЛАСТЬ Шепетівський район Вербівці,
, ХМЕЛЬНИЦЬКА ОБЛАСТЬ Шепетівський район Вербівці,
, ХМЕЛЬНИЦЬКА ОБЛАСТЬ Шепетівський район Старі Бейзими,
, ХМЕЛЬНИЦЬКА ОБЛАСТЬ Шепетівський район Старі Бейзими,
, Хмельницька Старосинявський с. Паньківці вул. БН, буд. 0,
, Черкаська Княжа,
, Черкаська обл. Канівський р-н Копіювато вул. , буд. й,
, Черкаська обл. Канівський р-н Копіювато вул. , буд. й,
, Чернівецька обл. Кіцманський р-н Драчинці вул. _, буд. _, кв. _,
, Чернівецька обл. Кіцманський р-н Драчинці вул. _, буд. _, кв. _,
, Чернівецька Сокирянський Ожеве Немає,
, 000 ДОНЕЦЬКА ОБЛАСТЬ Макіївка, місто Нижня Кринка вул. ЦЕНТРАЛЬНА, буд. 30, кв. 2,
, 000 ХЕРСОНСЬКА ОБЛАСТЬ Генічеський район Рівне вул. ЦЕНТРАЛЬНА, буд. 75,
, 0000 Євпаторійська Євпаторійський Мирний Сирникова, 7, 87,
Антрацит-4 Руставелі 14,
Дніпропетровська Маломихайлівка вул. Садова, буд. 3, кв.,
Дніпропетровська обл. Криворізький р-н Кривбас вул. Вишнева, буд. 23,
Дніпропетровська обл. Криворізький р-н Радіонівка вул. Космонавтів, буд. 4,
ДНІПРОПЕТРОВСЬКА ОБЛАСТЬ Дніпродзержинськ, місто Дніпродзержинськ вул. Менделеєва, буд. 7, кв. 65,
ДНІПРОПЕТРОВСЬКА ОБЛАСТЬ Дніпропетровськ, місто Дніпропетровськ вул. К.ЦЕТКІН, буд. 13А,
ДНІПРОПЕТРОВСЬКА ОБЛАСТЬ Криничанський район Вишневе вул. НОВА буд. 13,
ДНІПРОПЕТРОВСЬКА ОБЛАСТЬ Нікопольський район Червоногригорівка вул. Підгорна, буд. 109,
ДНІПРОПЕТРОВСЬКА ОБЛАСТЬ Петриківський район Лобойківка вул. КАЛИНОВА, буд. 37,
Дніпропетровська С. ЮВІЛЕЙНЕ вул. СОВХОЗНА, буд. 54А, кв. 82,
Донецька Єнакіївський Єнакієве Брайляна, Буд. 36, Кв. 26,
Донецька Макіївка, Місто Макіївка пров. Октябрський, буд. 4,
Донецька Николаевка Ул.З.Космодемянской 35,
ДОНЕЦЬКА ОБЛ М.СВЯТОГІРСЬК ВУЛ.1 МАЯ Б.56,
ДОНЕЦЬКА ОБЛАСТЬ Донецьк, місто Донецьк вул. ТОПЧИЄВА, буд. 6,
Донецька Харцизьк, Місто Іловайськ Федоренко, Буд. 5, А,
Житомирська Володарсько- Волинський Знам”Янка вул. Мініна, буд. 5,
Житомирська Володарсько- Волинський Хичів Некрасова, Буд. 9,
ЖИТОМИРСЬКА ОБЛАСТЬ Новоград-Волинський район Новоград-Волинський вул. СЕРГІЯ УВАРОВА, буд. 39,
Житомирська Попільнянський Кам”Янка пров. ПЕРШОТРАВНЕВА, буд. 36,
КИЇВ, місто КИЇВ, місто Київ б-р КОЛЬЦОВА, буд. 19, кв. 74,
КИЇВ, місто КИЇВ, місто Київ вул. БАКІНСЬКА, буд. 37А, кв. 150,
КИЇВ, місто КИЇВ, місто Київ вул. М.Драгомирова, буд. 4, кв. 26,
КИЇВ, місто КИЇВ, місто Київ вул. Світла , буд. 6, в/ч1498,
КИЇВ, місто КИЇВ, місто Київ вул. ЧЕРВОНОТКАЦЬКА, буд. 18, кв. 65/4,5,7,
КИЇВ, місто КИЇВ, місто Київ пров. ЛОБАЧЕВСЬКОГО, буд. 8-А,
КИЇВСЬКА ОБЛАСТЬ Ірпінь, місто Ірпінь вул. ПОКРОВСЬКА , буд. 1 ГУРТОЖ,
Луганська Антрацитівський м. Антрацит ВУЛ. 9 МАЯ,7/69,
Луганська Антрацитівський м. Антрацит СВЕЛОВА ,62,
Луганська Антрацитівський м. Антрацит ТИМІРЯЗЕВА,16,
Луганська Ровеньки вул. 1-ша лінія, буд. 6, кв.,
Львівська Пониковиця вул. Річна , буд. 2, кв.,
Миколаївська Кривоозерський тридуби вул. Калініна, буд. 12, кв.,
Рівненська обл. М. САРНИ ПРОВ. ОРЛОВСЬКІЙ, буд. 10,
СУМСЬКА ОБЛАСТЬ Роменський район Ромни вул. 3 Провулок Красний, буд. 57, кв. 27,
ХАРКІВСЬКА ОБЛАСТЬ Лозівський район Лозова вул. Благовіщинська , буд. 29, кв. 26,
ХЕРСОНСЬКА ОБЛАСТЬ Каланчацький район Бабенківка Друга вул. ЦЕНТРАЛЬНА, буд. 5,
ХЕРСОНСЬКА ОБЛАСТЬ Каховський район Каховка вул. Комінтнерна , буд. 2,
Херсонська Скадовський Тарасівка пров. ДРУЖБИ , буд. 39,
Хмельницька Волочиський Курилівка Шевченка, Буд. 7,
ХМЕЛЬНИЦЬКА ОБЛАСТЬ Волочиський район Бронівка БРОНІВКА, 1,
ХМЕЛЬНИЦЬКА ОБЛАСТЬ Волочиський район Поляни вул. Партизанська, буд. 36,
ХМЕЛЬНИЦЬКА ОБЛАСТЬ Городоцький район Веселець вул. Хутірська, буд. 13,
ХМЕЛЬНИЦЬКА ОБЛАСТЬ Хмельницький, місто Хмельницький вул. Проскурівського Підпілля , буд. 127/1, кв. 67,
Хмельницька Старосинявський Ара Синява Н.Левицького, Буд. 3,
ЧЕРКАСЬКА ОБЛАСТЬ Кам”янський район Пляківка вул. МИРУ, буд. 18,
Черкаська Чигиринський Топилівка вул. Слави, буд. 6,
Чернігівська Носівський Носівка вул. Ройченка , буд. 52,
ЧЕРНІГІВСЬКА ОБЛАСТЬ Ніжинський район Шатура вул. Новопольова, буд. 86/13, кв. 17,
Шахтарське Насонова,б.2,
, 000000 ДНІПРОПЕТРОВСЬКА ОБЛАСТЬ Криничанський район Вишневе вул. НОВА буд. 13,
, 000000 Донецька Слов”Янський Слов”Янськ Олімпійська, Буд. 1,
, 000000 КИЇВ, місто КИЇВ, місто Київ вул. Наталії Ужвій, буд. 6, кв. 14,
, 00101 Луганська Старобільський Старобільськ 00101, Луганська обл.,
, 00101 Луганська Старобільський Старобільськ 00101, Луганська обл.,
, 00643 Кіровоградська обл. Новгородківський р-н Новгородка вул. Вишнева, буд. 129,
, 01000 Київ, Місто Київ, Місто Київ В Гетьмана , Буд. 38, Кв. 33,
, 01000 Київ, Місто Київ, Місто Київ Воровського, Буд. 43-Б, Кв. 14,
, 01000 КИЇВ, місто КИЇВ, місто Київ вул. ДРАЙЗЕРА, буд. 20, кв. 94,
, 01000 Київська Жуляни 01000, Київська обл.,,
, 01000 Київська Таращанський Лісовичі 01000, Київська обл.,
, 01000 Київська Таращанський Лісовичі 01000, Київська обл.,
, 01000 Луганська Луганськ, Місто Луганськ вул. Шевченко, буд. 19,
, 01000 Полтавська м. Кременчук Житлобудівний пров., буд. 14,
, 01000, Україна, ВЕЗ ”Крим”, м. Сімферополь, вул. Парашутистов, буд. 42,
, 01000, Україна, Вінницька обл., КРИЖОПІЛЬСЬКИЙ р-н., с. КРИКЛИВЕЦЬ, вул. САДОВА, буд. 17,
, 01000, Україна, Вінницька, Вінницький, с. Парпурівці, вул. Шевченка, буд. 41,
, 01000, Україна, Вінницька, Гайсинський, Носівці, Садова, буд. 14,
, 01000, Україна, Вінницька, Гайсинський, Носівці, Садова, буд. 14,
, 01000, Україна, Вінницька, м. Вінниця, просп. Космонавтів, буд. 79, кв. 157,
, 01000, Україна, Вінницька, Мурованокуриловецький, с. Вищеольчедаїв, вул. Миру, буд. 10,
, 01000, Україна, Вінницька, Погребищенський, с. Малинки, вул. Колгоспна, буд. 5,
, 01000, Україна, Вінницька, Тиврівський, с. Яришівка, вул. Леніна, буд. 90,
, 01000, Україна, Вінницька, Ямпільський, Гальжбіївка, Калинова, буд. 23,
, 01000, Україна, Вінницька, Ямпільський, Цекинівка, Барська, буд. 48,
, 01000, Україна, Вінницька, Ямпільський, Ямпіль, Івана Франка, буд. 17,
, 01000, Україна, Волинська, -, Володимир-Волинський, Генерала Шухевича, буд. 123, корп. А, кв. 2,
, 01000, Україна, Волинська, Горохівський, смт. Мар`янівка, Залізнодорожна, буд. 29,
, 01000, Україна, Волинська, Іваничівський, Верхнів, Центральна, буд. 18,
, 01000, Україна, Волинська, Любешівський, Судче, Соборності, буд. 35,
, 01000, Україна, Дніпропетровська обл., АПОСТОЛІВСЬКИЙ р-н., м. ЗЕЛЕНОДОЛЬСЬК, вул. СВЯТКОВА, буд. 10, кв. 16,
, 01000, Україна, Дніпропетровська обл., ТОМАКІВСЬКИЙ р-н., ВИВОДОВЕ, МИРУ, буд. 35, кв. ВІДСУТНЯ,
, 01000, Україна, Дніпропетровська, -, Дніпро, Берегова, буд. 13,
, 01000, Україна, Дніпропетровська, -, Дніпро, Желваковського, буд. 6, кв. 30,
, 01000, Україна, Дніпропетровська, -, Дніпро, Косіора, буд. 47А, кв. 60,
, 01000, Україна, Дніпропетровська, -, Дніпро, Січових Стрільців, буд. 86, кв. 28,
, 01000, Україна, Дніпропетровська, -, Кривий Ріг, Княгині Ольги, буд. 10, кв. 3,
, 01000, Україна, Дніпропетровська, -, Кривий Ріг, Трамвайна, буд. 16, кв. 67,
, 01000, Україна, Дніпропетровська, Васильківський, Павлівка, -, буд. -,
, 01000, Україна, Дніпропетровська, Васильківський, Павлівка, -, буд. -,
, 01000, Україна, Дніпропетровська, Васильківський, с. Аврамівка, вул. Центральна, буд. 46,
, 01000, Україна, Дніпропетровська, Дніпровський, Підгородне, Українська, буд. 59,
, 01000, Україна, Дніпропетровська, м. Дніпро, вул. Благоєва, буд. 4, кв. 10,
, 01000, Україна, Дніпропетровська, м. Дніпро, вул. Будівельників, буд. 22, кв. 4,
, 01000, Україна, Дніпропетровська, м. Дніпро, вул. Мельченка, буд. 32,
, 01000, Україна, Дніпропетровська, м. Дніпро, вул. Семафорна, буд. 50, кв. 54,
, 01000, Україна, Дніпропетровська, м. Дніпро, просп. Богдана Хмельницького, буд. 35, кв. 20,
, 01000, Україна, Дніпропетровська, м. Кам`янське, вул. Дружби Народів, буд. 53б, кв. 22,
, 01000, Україна, Дніпропетровська, м. Кам`янське, вул. Інтернаціоналістів, буд. 14, кв. 86,
, 01000, Україна, Дніпропетровська, м. Кам`янське, просп. 50 років СССР, буд. 15, кв. 129,
, 01000, Україна, Дніпропетровська, м. Кам`янське, просп. Наддніпрянський, буд. 16, кв. 15,
, 01000, Україна, Дніпропетровська, м. Кам`янське, просп. Тараса Шевченка, буд. 2/28, кв. 80,
, 01000, Україна, Дніпропетровська, м. Кривий Ріг, вул. Яцьківа, буд. 19,
, 01000, Україна, Дніпропетровська, м. Нікополь, просп. Трубників, буд. 24, кв. 63,
, 01000, Україна, Дніпропетровська, Магдалинівський, Котовка, Майї Голенко, буд. 41,
, 01000, Україна, Дніпропетровська, Магдалинівський, Крамарка, Центральна, буд. 29,
, 01000, Україна, Дніпропетровська, Новомосковський, смт. Меліоративне, вул. Молодіжна, буд. 6, кв. 8,
, 01000, Україна, Дніпропетровська, Петриківський, с. Єлизаветівка, вул. Комунарна, буд. 15,
, 01000, Україна, Дніпропетровська, Петропавлівський, Петропавлівка, Урожайна, буд. 132,
, 01000, Україна, Донецька, -, Добропілля, Маліновського, буд. 10,
, 01000, Україна, Донецька, -, Мирноград, Світлий, буд. 3, кв. 7,
, 01000, Україна, Донецька, -, Мирноград, Челюскіна, буд. 129,
, 01000, Україна, Донецька, -, Покровськ, Шота, буд. 68, кв. 12,
, 01000, Україна, Донецька, Волноваський, Андріївка, Горького, буд. 4,
, 01000, Україна, Донецька, Волноваський, Волноваха, Желєзнодорожний, буд. 35, кв. 4,
, 01000, Україна, Донецька, Волноваський, Кирилівка, Шкільна, буд. 50,
, 01000, Україна, Донецька, м. Донецьк, вул. Даргомижського, буд. 23,
, 01000, Україна, Донецька, м. Покровськ, вул. Ахтирського, буд. 13,
, 01000, Україна, Донецька, Слов`янськ, Миколаївка, Миру, буд. 1, кв. 88,
, 01000, Україна, Житомирська, -, Житомир, 1й Мар`янівський, буд. 1, кв. 2,
, 01000, Україна, Житомирська, Любарський, Борушківці, Михайлівська, буд. 38,
, 01000, Україна, Житомирська, м. Житомир, вул. Бориса Лятошинського, буд. 18, кв. 19,
, 01000, Україна, Житомирська, м. Житомир, пров. Льва Нікуліна, буд. 9, кв. 3,
, 01000, Україна, Житомирська, Малинський, Нові Вороб`Ї, Шкільна, буд. 21,
, 01000, Україна, Житомирська, Малинський, Різня, Жукова, буд. 24,
, 01000, Україна, Житомирська, Малинський, Різня, Жукова, буд. 24,
, 01000, Україна, Житомирська, Народицький, с. Бабиничі, пров. Житомирський, буд. 4,
, 01000, Україна, Житомирська, Овруцький, с. Словечне, вул. -, буд. -,
, 01000, Україна, Житомирська, Овруцький, с. Словечне, вул. -, буд. -,
, 01000, Україна, Житомирська, Попільнянський, с. Квітневе, вул. Новобудова, буд. 110,
, 01000, Україна, Житомирська, Пулинський, смт. Пулини, Річний, буд. 9,
, 01000, Україна, Житомирська, Хорошівський, Березівка, Садова, буд. 27,
, 01000, Україна, Закарпатська обл., ВИНОГРАДІВСЬКИЙ р-н., с. ПІДВИНОГРАДІВ, вул. ПАРТИЗАНСЬКА, буд. 42,
, 01000, Україна, Закарпатська, Виноградівський, с. Підвиноградів, вул. Партизанська, буд. 48,
, 01000, Україна, Закарпатська, м. Мукачево, вул. Генерала Петрова, буд. 34, кв. 68,
, 01000, Україна, Закарпатська, Перечинський, с. Сімерки, вул. Центральна, буд. 142,
, 01000, Україна, Закарпатська, Свалявський, с. Керецьки, вул. Федоринська, буд. 33,
, 01000, Україна, Закарпатська, Хустський, Вільшани, Центральна, буд. 95,
, 01000, Україна, Запорізька обл., ВЕСЕЛІВСЬКИЙ р-н., с. МАТВІЇВКА, вул. АГРАРНА, буд. 24,
, 01000, Україна, Запорізька обл., ЗАПОРІЗЬКИЙ р-н., м. ГУЛЯЙПОЛЕ, просп. ДАЧНА, буд. 31,
, 01000, Україна, Запорізька, -, Енергодар, Молодіжна, буд. 59, кв. 32,
, 01000, Україна, Запорізька, Бердянський, с. Берестове, вул. Берестівська, буд. 53,
, 01000, Україна, Запорізька, Василівський, Дніпрорудне, Центральна, буд. 47, кв. 5,
